company_name,profile_url,company_web_site_url,location,tags,short_description,founding_date,founders,employee_range,emails,phones,description
Zolo Stays,https://e27.co/zolo-stays,https://zolostays.com/,India,,"We're a young, funded tech-based startup that offers managed co-living spaces. We provide our clients with trusted and comfortable living through ready-to-move-in rented rooms/beds that offer the best", , , , , , 
IoTalents,https://e27.co/iotalents,http://www.iotalents.com/,Singapore,"[[""Human Resources""]]","An online Talents-as-a-Service platform for hirers and IT/Digital Contingent Workforce (contract workers and virtual talents) to get intelligently connected and transact, using our Talenlytics knowled", , , , , , 
theright.fit,https://e27.co/theright-fit,https://theright.fit/,Australia,"[[""Consumer"",""E-commerce"",""Retail""]]","theright.fit is a global marketplace to connect talent with brands & clients, locally and around the world", , , , , , 
sai stock,https://e27.co/sai-stock,https://www.saistock.com,India,,"sai stock is best nifty tips provider in india. we provides share market tips and free intraday tips via sms. Get sure profit of 10000 to 50000 daily with best share tips provider.
", , , , , , 
BiztechCS,https://e27.co/biztechcs,https://www.bizztechcs.com,India,,"Biztech Web Development Blog with latest information and updates about Web Development Services like php development, open source web development, custom website designing, Web Application Development", , , , , , 
elabeauty,https://e27.co/elabeauty,https://elabeauty.com.vn/collections/my-pham-kbone-va-zoley,Vietnam,,, , , , , , 
Timeless Prints Pty Ltd,https://e27.co/timeless-prints-pty-ltd,https://www.timelessprints.com.au/,Australia,,Your Adelaide Commercial Photography Specialists, , , , , , 
Fortune Props,https://e27.co/fortune-props,http://www.fortuneprops.com/,India,"[[""Real Estate""]]","Fortuneprops is a Technology Enabled Corporate Work Place Services Company in India. Being a dedicated commercial property website, We offer the widest range of commercial real estate in Bangalore.", , , , , , 
Live Biking ,https://e27.co/live-biking,http://livebiking.in/,India,"[[""Mobile"",""Enterprise Solution"",""Software as a Service"",""Information & Communications Technology""]]","""Live Biking"" is technology driven network of authorized service centers and local service centers meant for repair and servicing of motorcycles.", , , , , , 
ZipEvent,https://e27.co/zipevent,http://www.zipeventapp.com,Thailand,"[[""Mobile"",""PR & Communications"",""Software as a Service"",""Information & Communications Technology""]]",ZipEvent is all-in-one event Management & PR platform that seamlessly connects attendees with event organizers and exhibitors., , , , , , 
Flolab,https://e27.co/flolab,http://flolab.co/,Indonesia,"[[""Design "",""Agency & Consulting""]]",They are a design studio focused on Product & UX Design. They work with startups to create simple and easy to use products., , , , , , 
Crafline.co.id,https://e27.co/crafline-co-id,http://craftline.co.id/,Indonesia,"[[""Design "",""E-commerce"",""Retail"",""Information & Communications Technology""]]","Crafline.co.id a site selling a creative product in Indonesia to provide a special place for the creative industries to introduce, promote, and sell.", , , , , , 
Clankart,https://e27.co/clankart,http://www.clankart.com/,India,"[[""E-commerce"",""Education"",""Information & Communications Technology""]]","Clankart is a free platform where students can Buy, Sell study materials like books,notes, etc from & to their Senior,Junior grads respectively 'Inside their College'  bypassing middleman's commission", , , , , , 
TRIMIY,https://e27.co/trimiy,http://www.trimiy.com,Singapore,"[[""Enterprise Solution"",""Design "",""E-commerce"",""Internet of Things"",""Advertising"",""Media"",""Platform"",""Information & Communications Technology""]]","TRIMIY is a digital agency with its own online digital mall called TRIMIY mall. Our digital services spread across Design, Media, and Web & App.", , , , , , 
Teeyoot,https://e27.co/teeyoot,http://www.teeyoot.com,Malaysia,,Teeyoot.com is a B2C & C2C e-commerce marketplace that allows businesses and individuals to create custom merchandises and sell them on social media for profits at zero costs!, , , , , , 
Ownow,https://e27.co/ownow,http://www.ownow.com/,India,"[[""E-commerce"",""Advertising"",""Information & Communications Technology""]]","OWNOW is a place for a you to unravel starling stuff, know about it, own it at a value price along with helping and sharing the products reviews and rating", , , , , , 
Detecon International & Asia-Pacific,https://e27.co/detecon-asia-pacific,http://www.detecon.com/ap/en/ap-startseite,Thailand,,, , , , , , 
Tantan,https://e27.co/tantan,http://tantanapp.cn/,China,"[[""Mobile"",""Platform"",""Software as a Service"",""Information & Communications Technology""]]","Tantan is a mobile app where you can meet interesting people in a fun and easy way.
", , , , , , 
eMarketer,https://e27.co/emarketer,http://emarketer.com/,United States of America,"[[""Consumer"",""E-commerce"",""Agency & Consulting"",""Advertising"",""Mobile"",""Information & Communications Technology""]]",eMarketer is the first place to look for information that will help you make better decisions in a digital world. , , , , , , 
theartling,https://e27.co/theartling,http://theartling.com/,Singapore,"[[""Architecture & Construction"",""Design "",""Entertainment"",""Social Enterprise"",""Information & Communications Technology""]]",The Artling showcases a curated collection of artists from around Asia and aims to showcase their artwork whilst making them more accessible, , , , , , 
Connecto,https://e27.co/connecto,http://www.connecto.io/,India,"[[""Agency & Consulting"",""Information & Communications Technology"",""Software as a Service""]]",Connecto builds tools that helps marketers/product managers communicate better with their visitors, , , , , , 
The PoolHood ,https://e27.co/the-poolhood,https://thepoolhood.wordpress.com/,Singapore,"[[""Advertising"",""Food & Beverage"",""Information & Communications Technology""]]","The PoolHood introduces you to places with excellent ambience, food of high quality and most importantly, a game of pool.", , , , , , 
BES Technologies Limited,https://e27.co/bes-technologies-limited,http://bes.hk/,Hong Kong,"[[""Software as a Service"",""Agency & Consulting""]]",They provide enterprise systems. They specialize in developing custom software applications and implementing customized solutions., , , , , , 
Espay,https://e27.co/espay,http://espay.id/,Indonesia,"[[""Finance"",""Mobile""]]","More payment options: credit cards, debit, direct bank transfer, e-money, etc. Espay is a payment cloud with the widest, most complete bank and nonbank payment channels in Indonesia.", , , , , , 
hashnext,https://e27.co/hashnext,,Vietnam, ,, , , , , , 
Rauve Technologies,https://e27.co/rauve-technologies,http://www.rauvetech.com/,Malaysia,"[[""Design "",""Mobile"",""Information & Communications Technology""]]",Rauve Technologies builds better web and mobile apps., , , , , , 
Lamp Post,https://e27.co/lamp-post,http://www.lamppostmedia.in/,India,,"Lamp Post Media is one of the leading digital marketing agency in Bangalore. We work on only Focusing Quality. Our clients are Kargil, Ayyan Fire Works Etc Hey,

are you Looking for Website design com", , , , , , 
Ranta Technologies,https://e27.co/ranta-technologies,http://www.ranta.my,Malaysia,"[[""E-commerce"",""Platform"",""Information & Communications Technology""]]",Rent and not throw away any unused item. Ranta provides user to rent items that they need when needed for short period only. While owner can rent out items they do not need anymore., , , , , , 
Isharingsoft,https://e27.co/isharingsoft,http://isharingsoft.com/,South Korea,"[[""Platform""]]",iSharing is an app that provides a real-time locator service allowing family members and close friends to privately share their location information and communicate with each other., , , , , , 
Magento Experts,https://e27.co/magento-experts,http://www.enlighteneditdevelopment.com/,Singapore,"[[""Design "",""Mobile"",""Software as a Service"",""Information & Communications Technology""]]","Magento Experts, And Website Designers For Ecommerce Websites, Joomla Developers, Prestashop Designers And Wordpress designing By Expert PHP Programmers.", , , , , , 
iSend delivery Service Co Ltd,https://e27.co/i-send-delivery-service-co-ltd,http://www.vrush.ph,Philippines,"[[""Consumer"",""E-commerce"",""Logistics\/Supply Chain"",""Platform"",""Social Enterprise"",""Transportation""]]",We are a Full Suite Land Based Logistics Co., , , , , , 
Practo,https://e27.co/practo,https://www.practo.com/company/about,India,"[[""Consumer"",""Healthtech"",""Software as a Service"",""Information & Communications Technology""]]","Practo is a technology firm which enhances patient experience by revving-up clinics across India with simple, technology products.", , , , , , 
THE MISSING PUZZLE,https://e27.co/the-missing-puzzle,http://www.themissingpuzzle.com,Singapore,"[[""Big Data"",""Design "",""Mobile"",""Software as a Service"",""Agency & Consulting""]]","A Singapore custom software development company that focus on delivering high value Custom iOS & Android Mobile App, System Software and Embedded System.", , , , , , 
Express Cashback,https://e27.co/express-cashback,,India,,"Get Extra Cashback, Discounts, Coupons & Local Offers when you shop via Expresscashback.in at Flipkart, Jabong, Myntra, Bigbasket & More", , , , , , 
Ads in Motion Global,https://e27.co/ads-in-motion-global,http://www.aimglobal.sg,Singapore,"[[""Advertising"",""Mobile""]]",Ads in Motion Global LLP was set up to offer Singapore companies and brands a cost effective platform to adopt augmented reality as part of their business solution or marketing/advertising campaigns., , , , , , 
Govt Jobs Portal,https://e27.co/govt-jobs-portal,https://www.GovtJobsPortal.IN,India,,Online Govt Jobs Portal in India provides latest updates related to the Government jobs available all over India., , , , , , 
Zosite India,https://e27.co/zosite-india,http://www.zosite.com,India,,"Zosite is a specialized IT outsourcing company in Ahmedabad, offering some of the finest Web designing, Web Hosting, Web Development, Search Engine Optimization (SEO) and website audit services.", , , , , , 
CRT Network Solutions ,https://e27.co/crt-network-solutions,https://www.crtnetworksolutions.com.au/,Australia,,We are an IT support company based in Brisbane and the Sunshine Coast. Our company mission is to provide the best possible IT support experience to our clients. We are always readily available to take, , , , , , 
CrowdNet,https://e27.co/crowdnet,http://pasa-net.com/,Philippines,"[[""Mobile"",""Information & Communications Technology""]]","CrowdNet is a mobile platform that enables individuals and small businesses to resell their Internet airtime. Our app identifies the exact device it will share Internet with, and will allocate minutes", , , , , , 
PT Anterin Digital Nusantara,https://e27.co/pt-anterin-digital-nusantara,http://www.anterin.id,Indonesia,"[[""Logistics\/Supply Chain"",""Transportation""]]","Anterin is a (mobile) marketplace that connecting people for transportation and delivery need using auction mechanism which user can choose drivers based on price, type of vehicles, even gender.", , , , , , 
Deeds,https://e27.co/deeds,,Philippines,,"Deeds is a rewards based application, fueled by good deeds.  Users do simple random acts of kindness and receives 'Deed points.' Accumulated deed points are then rewarded in various ways.", , , , , , 
Woowa Brothers,https://e27.co/woowa-brothers,http://woowahan.com/,South Korea,,"WOOWA BROS (우아한형제들) is a Korean developer of smartphone applications and advertising platforms. WOOWA BROS was established in March 2011 in Seoul, Korea.", , , , , , 
3D Printing Studios Asia Pte Ltd,https://e27.co/3d-printing-studios-asia-pte-ltd,http://www.3DPrintingStudios.com,Singapore,"[[""Hardware"",""Enterprise Solution"",""Healthtech"",""Manufacturing"",""Medtech""]]",3D Printing Studios is the Pioneer and Leading one stop 3D Printing Service Bureau and Solution Provider with regional operation in Singapore and Australia, , , , , , 
Piggipo,https://e27.co/piggipo,http://www.piggipo.com,Thailand,"[[""Finance"",""Mobile"",""Software as a Service""]]",Piggipo is an application for managing Credit card in THAILAND., , , , , , 
Think Future Technologies,https://e27.co/think-future-technologies,https://www.tftus.com/,United States of America,"[[""Artificial Intelligence"",""Augmented Reality"",""Big Data"",""Blockchain"",""Design "",""Information & Communications Technology"",""Virtual Reality""]]","""Think Future Technologies (TFT) is a leading software development and testing company with their offices based in India, U.S,  and Isreal.", , , , , , 
Eleven Sports,https://e27.co/eleven-sports,http://elevensportsnetwork.com/,Singapore,"[[""Media"",""Sports""]]","ELEVEN SPORTS aims to be the leading global sports platform by meeting the demands of underserved, connected and local fans, everywhere.", , , , , , 
Burufly,https://e27.co/burufly,http://www.burufly.com/,Indonesia,"[[""E-commerce"",""Media"",""Travel"",""Information & Communications Technology""]]","Burufly is changing the way people research, plan, book and share their journeys.", , , , , , 
Roosterly,https://e27.co/roosterly,http://www.roosterly.com/,United States of America,,"We help individuals and small businesses build their personal brand, grow their network and increase sales by engaging with their social networks through quality curated content from top publishers.", , , , , , 
The ODM Group,https://e27.co/the-odm-group,http://www.theodmgroup.com/,China,"[[""Advertising""]]",, , , , , , 
AML360,https://e27.co/aml360,http://www.aml360software.com,Singapore,"[[""Big Data"",""Finance"",""Software as a Service""]]","AML360 is a leading vendor in anti-money laundering compliance software.  We provide businesses with a dashboard where they can carry out customer profiling, transaction monitoring and much more.", , , , , , 
Birthday and Corporate Event Organisers Mumbai - Party Planet,https://e27.co/birthday-and-corporate-event-organisers-mumbai-party-planet,http://www.partyplanetindia.com,India,"[[""Entertainment""]]","Planning an event that perfectly balances organisational excellence and the entertainment quotient is serious business, one that has been elevated to a fine art at Party Planet.", , , , , , 
webzentra,https://e27.co/webzentra,http://webzentra.co.in/,India,,Our digital marketing work speaks for itself. We deliver an outstanding service custom-tailored to each and every one of our clients — big or small., , , , , , 
VR Today Magazine,https://e27.co/vr-today-magazine,,United States of America,,, , , , , , 
Polama,https://e27.co/polama,http://www.polama.com/,India,"[[""Travel""]]","Polama is an online holiday comparison portal for tour packages and holiday deals from hundreds of tour operators, hotels & resorts.", , , , , , 
Discount Promo Codes,https://e27.co/discount-promo-codes,https://www.discountpromocodes.co.uk,United Kingdom,"[[""Enterprise Solution""]]","Discount promo codes is the money saving site in the United Kingdom that provide Discount Codes, Promo Codes and Deals for online shopping. We give 20% net profits to charity.", , , , , , 
ICONStrategies ,https://e27.co/iconstrategies,http://www.iconstrategiesbpo.com/,Philippines,"[[""Design "",""Enterprise Solution"",""Software as a Service"",""Information & Communications Technology""]]","At ICONStrategies, they focus on one thing, helping you succeed, and they offer a variety of services that can be tailored to fit your specific needs.", , , , , , 
Jebhealth,https://e27.co/jebhealth,https://jebhealth.com,Singapore,"[[""E-commerce"",""Healthtech""]]",An online marketplace for healthcare services with a focus on preventive care in Southeast Asia., , , , , , 
ECGObike,https://e27.co/ecgobike,http://www.ecgobike.co.id,Indonesia,"[[""Automotive"",""Cleantech"",""Consumer"",""Information & Communications Technology"",""Internet of Things""]]",, , , , , , 
8AM Vietnam,https://e27.co/8am,https://8am.vn,Vietnam,,, , , , , , 
SimWave,https://e27.co/simwave,https://www.simwave.ca/,Canada,"[[""Virtual Reality""]]",SimWave offers custom Virtual Reality and Augmented Reality development of compelling interactive training and experiential scenarios., , , , , , 
Talenta,https://e27.co/talenta,http://talenta.co/,Indonesia,"[[""Finance"",""Agency & Consulting"",""E-commerce"",""Human Resources"",""Software as a Service""]]","Talenta is a cloud-based Software as a Service that aims to help small and medium businesses manage their HR processes, from attendance, leave requests, overtime and most importantly: payroll.", , , , , , 
Giottus Technologies Private Limited,https://e27.co/giottus-technologies-private-limited,http://www.giottus.com,India,,Cryptocurrency exchange with support for multiple base pairs and powerful tools, , , , , , 
