company_name,profile_url,company_web_site_url,location,tags,short_description,founding_date,founders,employee_range,emails,phones,description
NotifyVisitors,https://e27.co/notifyvisitors,https://www.notifyvisitors.com,India,,"NotifyVisitors is the simplest marketing automation software to send personalized push notifications and messages to customers. NotifyVisitors provide integration with multiple platforms
", , , , , , 
Stamp,https://e27.co/stamp,http://www.getmystamp.com/,Thailand,"[[""Hardware"",""Mobile"",""Software as a Service""]]","Stamp is a cardless loyalty program that lets businesses give special treatment to their regular customers, and lets customers keep all of their loyalty cards on their mobile phones.", , , , , , 
UMAI,https://e27.co/umai,http://www.letsumai.com,Malaysia,,UMAI is a software provider that helps restaurants to save time and increase revenues by automation and personalized service., , , , , , 
Easytune,https://e27.co/easytune,http://www.easytune.in/,Indonesia,"[[""Entertainment"",""Information & Communications Technology""]]","Easytune is an app where you can discover your music, search your all favorite songs, create playlists, share to others, and listen to them - anywhere and anytime.", , , , , , 
Rapid Tunnel Servicz,https://e27.co/rapidtunnelservicz,https://www.rapidtunnelservicz.com/,India,"[[""Agency & Consulting"",""Consulting"",""Finance"",""Food & Beverage"",""Legal""]]","Liasoning Consultant Providing Services For Gst Registration, Company Registration, Trademark registration, Fssai Food License Etc.", , , , , , 
KLIK KATA,https://e27.co/klik-kata,http://www.klikkata.com/,Indonesia,,website quotes, , , , , , 
Tik Tok,https://e27.co/tik-tok,https://www.amemv.com/,China,"[[""Entertainment"",""Social Enterprise""]]","Tik Tok is a short-video social platform powered by music. Whether it’s dance, free-style or performance, creators are encouraged to let their imagination run wild and set their expressions free.", , , , , , 
Flightsbird.com,https://e27.co/flightsbird-com,https://www.flightsbird.com/,United States of America,,"Flightsbird.com, the hybrid flight booking, and comparison website compare flights of millions of routes on more than 450 airlines to help you find cheapest airplane tickets with a single click.", , , , , , 
Bayut.com,https://e27.co/bayut-com,https://www.bayut.com/,United Arab Emirates,"[[""Advertising"",""Real Estate"",""Information & Communications Technology""]]",Bayut.com is one of the top players of the UAE online real estate market., , , , , , 
Nomster,https://e27.co/nomster,http://www.nomster.com/,Singapore,,"Vanquish your hunger with Nomster, the mobile app that celebrates the marriage between gaming and food discovery.", , , , , , 
Jasa Pembuatan Toko Online,https://e27.co/jasa-pembuatan-toko-online,http://achmadrifai.com,Indonesia,"[[""Information & Communications Technology""]]",jasa pembuatan toko online dengan harga terjangkau namun tetap dengan fitur yang sangat lengkap dan profesional ., , , , , , 
JustConnect Pte Ltd,https://e27.co/justconnect-pte-ltd,http://www.justconnect.media,Singapore,"[[""Media"",""Sports""]]",JustConnect Pte Ltd is a media and technology company that serves the active community in Asia – Pacific., , , , , , 
BS Alpha Technology USA LLC,https://e27.co/bs-alpha-technology-usa-llc,https://www.alphaott.com/,United States of America,,"The means of entertainment has changed with time. Now you don’t need to stay at home to watch your favorite channel, movies, and videos due to technological advancements. ", , , , , , 
SoVou Pte Ltd,https://e27.co/sovou-pte-ltd,http://www.sovou.com,Singapore,"[[""Advertising""]]","A Referral Marketing System designed for Offline Businesses.

We get their customers to sell for them by giving rewards for successful referrals & make it very easy for them to share online & offline!", , , , , , 
Fingerlix,https://e27.co/fingerlix,https://www.fingerlix.com/,India,"[[""Food & Beverage""]]","Fingerlix provides fresh ‘almost-ready’ food solutions like Batters, Mixes, Curries, Dals, Parathas and ‘fully-ready’ accompaniments to go with them.", , , , , , 
hyperledger,https://e27.co/hyperledger,http://www.hyperledger.com/,United States of America,"[[""Consumer"",""Information & Communications Technology""]]",The Hyper Ledger Transfer Protocol is a completely new protocol for enabling payments over the internet. From transferring money from one side of the world., , , , , , 
Xebec Digital,https://e27.co/xebec-digital,http://www.xebecdigital.com,India,"[[""Big Data"",""Advertising"",""Information & Communications Technology""]]",Xebec is one of the leading integrated Digital Marketing Agencies of India. They develop and employ the best digital marketing strategies and creative technology solutions., , , , , , 
Akadasia,https://e27.co/akadasia,http://www.akadasia.com,Singapore,"[[""Education""]]",Akadasia is a mission driven buisness that aims to disrupt the education technology services sector in Asia through its learning management platform which allows students to learn anything at anytime from anywhere in the language of their choice., , , , , , 
Ellipsonic,https://e27.co/ellipsonic,http://www.ellipsonic.com,Singapore,"[[""Enterprise Solution"",""Big Data"",""Internet of Things"",""Agency & Consulting""]]","Supporting businesses, start-ups and entrepreneurs with world class tech development.", , , , , , 
China Comservice,https://e27.co/china-comservice,http://www.chinaccsi.com/en/,Hong Kong,,Telecom infrastructure service provider, , , , , , 
Watt,https://e27.co/watt,http://www.wa-tt.com,Singapore,,"Watt digitalises events of solidarity such as marches, marathons and charity runs so that people from across the world can participate in them without having to travel to a different location.", , , , , , 
Greenbeast Corporation,https://e27.co/greenbeast-corporation,https://www.facebook.com/markanthonyvillazorda,Philippines,,, , , , , , 
"GameCoach., Inc",https://e27.co/gamecoach-inc,http://us.gamecoach.net,South Korea,"[[""Media"",""Platform""]]","We are the platform for gamers who wanna learn games, teach games, share information of games.", , , , , , 
Tour and Travel Blog,https://e27.co/tour-and-travel-blog,http://tourandtravelblog.com,India,,Tour and Travel Blog is a community tour and travel blog started by Ariana Smith in 2015 for sharing experience and knowledge of traveling and tour to the world., , , , , , 
VentureBeat,https://e27.co/venturebeat,http://venturebeat.com,United States of America,"[[""Big Data"",""Education"",""Finance"",""Advertising"",""Media"",""Information & Communications Technology""]]",VentureBeat is an online technology news platform that is engaged in technology publication and events business., , , , , , 
RideOnCab,https://e27.co/rideoncab,http://www.rideoncab.com/,India,"[[""Automotive"",""E-commerce"",""Mobile"",""Enterprise Solution"",""Software as a Service"",""Transportation"",""Information & Communications Technology""]]",Through “RideOnCab” people can book a cab by searching for the best services and prices. The app gives you access to the largest network of reliable cabs., , , , , , 
Sky Digital Agency,https://e27.co/sky-digital-agency,http://www.skydigitalagency.com,Singapore,,"We bring value to the creative industry, especially helping startups, non-profits and social enterprises build better online presence, understand about digital marketing.", , , , , , 
Digital Marketing Course Training in Chennai,https://e27.co/zuan-education,https://www.zuaneducation.com/,India,"[[""Education"",""Information & Communications Technology""]]","Zuan Education is an academic and training wing of Zuan Technologies a services firm offering design, development and online marketing solutions with clients across the globe.", , , , , , 
IdeaCracker,https://e27.co/ideacracker,http://ideacracker.com,Singapore,"[[""E-commerce""]]",Furniture crowdfunding platform with manufacturing expertise., , , , , , 
People Squared,https://e27.co/people-squared,http://www.people-squared.com/en/,China,"[[""Platform""]]",P2 startup space provides startup teams with a flexible and professional working environment comparable to that of Google's office., , , , , , 
ATEES PTE LTD,https://e27.co/atees-pte-ltd,https://www.atees.sg,Singapore,,, , , , , , 
Split 1700 Tennis,https://e27.co/split-1700-tennis,http://www.split1700tennis.com,China,,"Split 1700 Tennis is a coaching organization opened in summer 2014 in Shanghai, China. It is specialized in coaching tennis for all ages and levels: Professionals, Junior High Performance, Beginners,", , , , , , 
Aroma Bit Inc.,https://e27.co/aroma-bit-inc,http://www.aromabit.com/,Japan,"[[""Internet of Things"",""Agency & Consulting""]]","They envision a world where invisible odor/aroma is visualized through their odor/aroma imaging sensor, realizing a disruptive innovative services using their sensor.", , , , , , 
goNguide,https://e27.co/gonguide,http://www.gonguide.com/,Indonesia,"[[""Travel""]]","goNguide provides a platform that links travel agents and tour leaders. it will also minimize the amount of papers that tour leaders have to carry,", , , , , , 
CanisnFelis,https://e27.co/canisnfelis,http://www.canisnfelis.com/,Indonesia,"[[""Design "",""Gaming"",""Information & Communications Technology""]]","CanisnFelis are providing a wide variety of professional services to Small and Midsize Businesses, from Website Design and Development, Flash Design and Animation etc.", , , , , , 
FindusLawyers.Org,https://e27.co/finduslawyers-org,http://www.finduslawyers.org/,United States of America,,"Find US Lawyers Directory is extremely easy, effective, and affordable way for attorneys and law firms to advertise on the Internet and promote their brand.", , , , , , 
Dreamlabs Innovation,https://e27.co/dreamlabs-innovation,http://www.dreamlabs.sg,Singapore,,"We are a $50 million fund established to invest in companies, leaders, and ideas that positively impact the lives of people. Our aim is to work with entrepreneurs who seek to invent new markets.", , , , , , 
Waresix,https://e27.co/waresix,https://waresix.com/,Indonesia,"[[""Logistics\/Supply Chain""]]","They are here to assist you in leveraging industry scale, creating unprecedented flexibility in your operations and transforming your supply chain into a competitive advantage.", , , , , , 
YCo,https://e27.co/yco,http://www.yco.io,Singapore,"[[""Enterprise Solution"",""Media"",""Advertising"",""Platform""]]","YCo, the new coworking intiative from YDMG Korea that believes in the power to bring the best entrepreneurs in Asia together. 
Cocreate. Connect. Collaborate.", , , , , , 
Whizz Education,https://e27.co/whizz-education,http://www.whizz.com,United Kingdom,,"Whizz Education delivers effective personalised tutoring and learning to captivated children worldwide, while delivering increased confidence and achievement in maths.", , , , , , 
LEH LEH Sports,https://e27.co/leh-leh-sports,http://lehlehsports.com/,India,"[[""Sports""]]",LEH LEH Sports creates easy access to sports for individual and corporate., , , , , , 
Payboy Pte. Ltd.,https://e27.co/payboy,https://payboy.biz,Singapore,"[[""Finance"",""Enterprise Solution"",""Agency & Consulting""]]",Payboy reinvents Human Resource Management for present-day SMEs. We help shed off massive amount of time used in HR administrative and paperwork. We make HR lean in every company., , , , , , 
Academy Inks,https://e27.co/academy-inks,http://www.academyinks.com/,South Korea,"[[""Education""]]",Academy Inks provides fun activities and services for English Academies and School in South Korea., , , , , , 
Piing Pte Ltd,https://e27.co/piing-pte-ltd,https://piing.com.sg,Singapore, ,, , , , , , 
Tyremarket Pvt. Ltd.,https://e27.co/tyremarket-pvt-ltd,https://www.tyremarket.com/,India,,"Online market place for buy and sell tyre online at discount price. Bring together consumers and dealers of automobile tyres, tubes and alloy wheels to create a friendly, informed and beneficial envir", , , , , , 
Maple Inc - Study Overseas,https://e27.co/maple-inc,https://meoverseas.com/,India,"[[""Consulting"",""Education""]]",Maple Inc providing opportunity to students where they can gain from their education overseas. We help students towards their chosen career paths at the destinations of their choices., , , , , , 
Genie8,https://e27.co/genie8,http://genie8.com/,Australia,"[[""Big Data"",""Enterprise Solution""]]","Genie8 is a new cloud based digital information engine, increasing productivity by instantly and automatically detecting changes in any type of online data.", , , , , , 
PlayCez,https://e27.co/playcez,http://www.playcez.com/,India,"[[""Mobile"",""Software as a Service"",""Travel"",""Information & Communications Technology""]]","PlayCez is built a scalable platform which uses proprietary algorithms to capture, analyse and recommend this information. They are currently covering 11 major cities in India.", , , , , , 
Izifly corp lp,https://e27.co/izifly-corp-lp,http://www.izifly.com,United Kingdom,"[[""Travel""]]","Online travel agency for flights, hotels, car rental ticket booking", , , , , , 
Shoot 'N' Sell,https://e27.co/shoot-n-sell,http://shootnsell.co/,Philippines,"[[""Advertising"",""E-commerce"",""Mobile"",""Software as a Service"",""Information & Communications Technology""]]",Shoot‘N’Sell aims to tap into the growing ecommerce market in the Philippines by creating a mobile photo advertisement app for online merchants., , , , , , 
Brain9D,https://e27.co/brain9d,http://Brain9d.com,Malaysia,"[[""Big Data"",""Healthtech"",""Medtech""]]","Empowering people to assess, monitor, track and manage their brain and mental health - Keeping You Mentally Healthy", , , , , , 
Cityfarm,https://e27.co/cityfarm,https://cityfarm.my/,Malaysia,"[[""Agritech"",""Food & Beverage""]]",CityFarm Malaysia is a newly-founded organization whose objective is to inspire more city farmers with the ability to grow locally from anywhere for a more sustainable future of food production., , , , , , 
Insightz Survey,https://e27.co/insightz-survey,http://insightzclub.com/,Malaysia,,The founding team consists of professionals with senior management level experience in market research & analytics across Asia-Pacific, , , , , , 
VE CLEAN,https://e27.co/ve-clean,,India,"[[""Social Enterprise""]]","VE-CLEAN is a Madurai Based Start-up, providing professional Cleaning service to households and commercial establishments.", , , , , , 
Workosaur,https://e27.co/workosaur,http://www.workosaur.com/,India,"[[""Advertising"",""Human Resources"",""Information & Communications Technology""]]",Workosaur.com is a free job board for senior positions i.e. jobs that pay more than Rs. 10+ lakh per annum. , , , , , , 
Geraiku ID,https://e27.co/geraiku,https://geraiku.store,Indonesia,"[[""E-commerce"",""Enterprise Solution"",""Mobile"",""Retail""]]","Geraiku provides equal access to customer, capital and mobile technology to traditional grocery stores by elevating them against business disruption.", , , , , , 
Ixpress647 Logistics,https://e27.co/ixpress647-logistics,http://www.ixpress647.com,Singapore,"[[""Logistics\/Supply Chain"",""Transportation""]]","At Singapore Courier Service Ixpress647, we provide same day / half day and urgent deliveries throughout Singapore. What sets us apart from others is we do not take any commission from our drivers.", , , , , , 
Camp Mobile,https://e27.co/camp-mobile,http://www.campmobile.com/,South Korea,"[[""Mobile"",""Software as a Service"",""Agency & Consulting""]]",Camp Mobile is on special camping to the better mobile world. They aim to provide valuable mobile experiences to users all around the world. , , , , , , 
Ydigital Asia,https://e27.co/ydigital-asia,https://ydigital.asia/,Indonesia,"[[""Agency & Consulting"",""Advertising""]]",, , , , , , 
Med Code Data,https://e27.co/medcodedata,https://medcodedata.com,United States of America,"[[""Enterprise Solution"",""Big Data"",""Healthtech"",""Advertising"",""Agency & Consulting"",""Information & Communications Technology""]]","MedCodeData.com offers a gigantic database of medical codes to the public at zero cost. You can lookup information of any medical codes (ICD, ATC, NDC, HCPCS, CPT)", , , , , , 
MattsenKumar LLC,https://e27.co/mattsenkumar-llc,https://www.mattsenkumar.com/,United States of America,,"For more than 15 years, MattsenKumar has been a pioneer in establishing and transforming contact center operations for leading organizations across the globe.", , , , , , 
Action Group (Pte.) Ltd,https://e27.co/action-group-pte-ltd,http://www.actionmedia.sg,Singapore,"[[""Advertising"",""E-commerce"",""Media"",""Mobile"",""Travel"",""Information & Communications Technology""]]",, , , , , , 
RiteTag,https://e27.co/ritetag,http://ritetag.com/,Japan,"[[""Big Data"",""Advertising"",""Information & Communications Technology""]]","RiteTag identifies hashtags that got results and leads you to use them more, continually refining your smart-tagging.", , , , , , 
Pitch Clear,https://e27.co/pitch-clear,http://www.pitchclear.com/,Indonesia,"[[""Platform""]]","THIS IS FOR person, profession, product, service, organization or event WHO were not always or never had a chance to pitching their ideas to journalists, investors, partners, or potential clients.", , , , , , 
Uitox Global,https://e27.co/uitox-global,http://www.uitox.com/c/web/uitox/index.html,Taiwan,"[[""E-commerce""]]","Uitox is a global e-commerce group, providing the following services in cities around the world.", , , , , , 
Vishraam Builders,https://e27.co/vishraam-builders,http://www.vishraam.com/,India,"[[""Architecture & Construction"",""Real Estate""]]","Vishraam Builders is one of the best and trusted builders in Thrissur provides eco-friendly apartments in Guruvayur, Thrissur and Palakkad. Good location and astounding amenities offer.", , , , , , 
Eazytec,https://e27.co/eazytec,http://www.eazytec.com/,China,"[[""Enterprise Solution"",""Big Data""]]",Jiangsu-based Eazytec is a smart city developer and service provider with proprietary core firmware (BIOS) technology., , , , , , 
ANMEZ,https://e27.co/anmez,http://www.anmez.com/en,Hong Kong,"[[""Consumer"",""Healthtech""]]",The invention and promotion of eco-testers and instruments for measuring the quality of life and food., , , , , , 
OpenTable,https://e27.co/opentable,http://opentable.com/,Singapore,"[[""E-commerce"",""Mobile"",""Software as a Service"",""Information & Communications Technology""]]","OpenTable is a leading provider of free, real-time online restaurant reservations for diners and reservation and guest management solutions for restaurants.", , , , , , 
Qseap Technologies,https://e27.co/qseap-technologies,http://www.qseap.com/,India,"[[""Cybersecurity"",""Agency & Consulting"",""Software as a Service""]]",Qseap Technologies Pvt. Ltd. is a Customer focused IT firm whose primary point of focus is the growth in business of the Enterprise Organizations. , , , , , , 
21fools,https://e27.co/21fools,http://21fools.com/,India,"[[""Agritech"",""Design "",""E-commerce"",""Information & Communications Technology""]]",Plantable seed paper products that bloom into flowers when planted., , , , , , 
Vault Labs,https://e27.co/vault-labs,http://Vaultlabs.com,Singapore,"[[""Agency & Consulting"",""Big Data"",""Advertising""]]",Vault Labs is a digital growth marketing company that helps Ecommerce and Regional Brands build their customer growth from IDEAS to EXECUTION., , , , , , 
EventClique,https://e27.co/eventclique,https://www.eventclique.com/,Singapore,"[[""Entertainment"",""Advertising"",""Enterprise Solution"",""Information & Communications Technology""]]","eventCliQue is a unique social ticketing gateway that brings together show promoters, event organisers, venue partners, marketers and event-goers across Asia. 
", , , , , , 
POFI Technologies,https://e27.co/pofi-technologies,http://homestaydnn.com/,India,,, , , , , , 
Toimisto-hotelli.fi,https://e27.co/toimisto-hotelli-fi,https://www.toimisto-hotelli.fi/,Finland,,Toimisto-hotelli.fi offers a comprehensive database and an overview of offices in Finland., , , , , , 
Kata.ai,https://e27.co/kata-ai,http://kata.ai/,Indonesia,"[[""Internet of Things"",""Agency & Consulting""]]","We Walk the Talk. Suited with Natural Language Processing (NLP) technology, Kata.ai is a service which provides intelligent chatbot who speaks and understands Indonesian language.", , , , , , 
Icertis,https://e27.co/icertis,http://www.icertis.com/,India,"[[""Enterprise Solution"",""Software as a Service""]]",Icertis is the leading provider of enterprise contract management software in the Microsoft Cloud. T, , , , , , 
Upshotly,https://e27.co/upshotly,https://www.upshotly.com,India,,Upshotly helps simplify employee performance management for fast-growing businesses., , , , , , 
TreePlanet,https://e27.co/treeplanet,http://treepla.net/,South Korea,"[[""Gaming"",""Mobile"",""Agency & Consulting""]]",Tree Planet 3 is an adventure-based mobile game developed by TreePlanet., , , , , , 
BmCoder,https://e27.co/bmcoder,https://www.bmcoder.com,India,,Web development company in Ahmedabad - Gujarat, , , , , , 
Rokid Corporation,https://e27.co/rokid-corporation,https://www.rokid.com/,China,,"Established in July 2014, Rokid specialises in robotics research and AI development. The firm essentially provides voice-interactive access to weather, smart home automation, music, radio, weather...", , , , , , 
WeNirman Retail Solutions LLP,https://e27.co/wenirman-retail-solutions-llp,http://www.wenirman.com/,India,"[[""Architecture & Construction"",""E-commerce"",""Real Estate"",""Retail"",""Smart Cities""]]","India’s first and only one stop destination to shop all post construction needs which includes categories like Electrical, Lighting, Bathware, Kitchenware, Hardware, Home Automation, etc.", , , , , , 
Smart AHC,https://e27.co/smart-ahc,https://www.smartahc.com/company/index,Singapore,"[[""Agritech""]]","Smart AHC provides e-traceability capabilities for pig farmers. Their technology optimises productivity yield of pigs through predictive analytics, and caters to a rapidly growing market", , , , , , 
Applato,https://e27.co/applato,https://www.myapplato.com/,Taiwan,,Applato is a restaurant platform that provides personalised dietary recommendations and meal ordering for people with special health needs., , , , , , 
Billion Hands Technology Pvt. Ltd,https://e27.co/billion-hands-technology-pvt-ltd,http://www.billionhands.in/,India,"[[""Software as a Service""]]",Billion Hands Technology is an outsourced product development company that provides end-to-end software solutions for domains that demand high-end technology., , , , , , 
Bowen Partners,https://e27.co/bowen-partners,http://www.bowenpartners.com.hk/,Hong Kong,"[[""Finance""]]","Bowen Partners is an executive search and talent development firm. They are true experts in identifying talent within Finance, Compliance & Risk within the Banking & Financial Services sectors.", , , , , , 
SleekDigital LLP,https://e27.co/sleekdigital-llp,https://www.sleekdigital.sg,Singapore,,We are a Singapore Mobile App Development Agency and Digital Consultancy providing cheap App Development and Digital Consulting Services., , , , , , 
Apta Biosciences,https://e27.co/apta-biosciences,http://www.aptabiosciences.com/,Singapore,"[[""Biotech"",""Big Data"",""Healthtech""]]","Apta Biosciences has developed a proprietary, groundbreaking method for creating synthetic alternatives to antibodies, a core component of medical diagnostics and therapeutics.", , , , , , 
Greatlike Media,https://e27.co/greatlike-media,https://www.greatlike.com/,United States of America,,Orange County Web Design and Digital Marketing Agency that specializes in website design and development services as well as internet marketing for small businesses., , , , , , 
Pulsehyip Software Solution,https://e27.co/pulsehyip-software-solution,https://www.pulsehyip.com/ethereum-dapps-development-company-in-india,India,,Pulsehyip is the best Ethereum DApp Development Services.  We dedicatedly working to bring the latest Ethereum blockchain development to cover cutting-edge technologies to bring you next level., , , , , , 
SuperCharger Fintech Accelerator,https://e27.co/supercharger-fintech-accelerator,https://www.fintechsupercharger.com/,Malaysia,"[[""Agency & Consulting"",""Finance""]]","Strategically located in Hong Kong and Kuala Lumpur, SuperCharger is the first FinTech accelerator dedicated to both early-stage and growth-stage startup companies. SuperCharger’s recent expansion int", , , , , , 
Indian OpenCart Developers,https://e27.co/indian-opencart-developers,http://www.indianopencartdevelopers.com/,India,"[[""Design "",""E-commerce"",""Information & Communications Technology""]]","Indian Opencart Developers is the best ecommerce website development service provider in India. We offers opencart development service, extension & maintenance services in India, USA,UK, Australia.", , , , , , 
CoinMarketFeed,https://e27.co/coinmarketfeed,https://www.coinmarketfeed.com/,India,"[[""Finance"",""Information & Communications Technology""]]","CoinMarketFeed Provides Cryptocurrency Prices, Coin Market Cap, Cryptocurrency News, Cryptocurrency 24h Volume. We also cover Cryptocurrency Exchange, Cryptocurrency Development and Technical Stats.", , , , , , 
Arcatron,https://e27.co/arcatron,http://arcatron.com/,India,"[[""Hardware"",""Mobile""]]",Arcatron is building the next generation of mobility devices to make technology the best care giver for individuals with limited mobility., , , , , , 
