company_name,profile_url,company_web_site_url,location,tags,short_description,founding_date,founders,employee_range,emails,phones,description
Cashtree,https://e27.co/cashtree,http://www.cashtree.id/,Indonesia,"[[""Advertising"",""Mobile"",""Software as a Service""]]",Cash tree is an android application that gives free mobile cash and advertise through lockscreen, , , , , , 
ResponSight,https://e27.co/responsight,http://www.responsight.com/,Australia,"[[""Enterprise Solution"",""Cybersecurity""]]",ResponSight is about trust - customers want to trust your business; staff want to trust the systems and network; and you want to trust your people are protecting both the business and your customers., , , , , , 
WordpressWebsite.in - Wordpress Development Company,https://e27.co/wordpresswebsite-in,http://www.wordpresswebsite.in/,India,"[[""Design "",""E-commerce"",""Information & Communications Technology""]]","WordpressWebsite.in is a leading WordPress web development company based in India. We build elegant, handy, adaptable and responsive websites using the power of Wordpress platform.", , , , , , 
Live Your Sport,https://e27.co/live-your-sport,http://www.liveyoursport.com/,India,"[[""E-commerce"",""Sports""]]","Live Your Sport is an online one-stop shop and community committed to helping sports and fitness lovers find the best equipment and gain insight into various aspects of health, injury and recovery.", , , , , , 
Nemmadi,https://e27.co/nemmadi,https://www.nemmadi.in/,India,,"A leader in Home Inspection & Pre Delivery Quality Inspection services, in India. Nemmadi offers you complete peace of mind.", , , , , , 
MBD Connect,https://e27.co/mbd-connect,https://www.mbdconnect.com/,India,,MBD Connect is a comprehensive school management ERP system that ensures the systematize running of a school and enhance the efficiency. MBD Connect aims to ease out the stress behind the working of t, , , , , , 
DKSH ,https://e27.co/dksh,http://www.dksh.com/cs/dksh_com/o/home,Switzerland,"[[""Agency & Consulting"",""Logistics/Supply Chain"",""Agency & Agency & Consulting"",""Advertising""]]",DKSH is the leading Market Expansion Services Group with a focus on Asia. They help companies who are looking for a reliable outsourcing partner to grow their business in new or existing markets., , , , , , 
Sandklock,https://e27.co/sandklock,http://www.sandklock.com/,Vietnam,"[[""Big Data"",""E-commerce"",""Platform"",""Information & Communications Technology""]]",Sandklock delivers technology services and improve companies by solving complex business challenges with breakthrough technical innovations., , , , , , 
Coffitude,https://e27.co/coffitude,http://www.coffitude.com/,India,"[[""Food & Beverage""]]","Coffitude-health on the go, India's first mobile health cafe serves ""Quality health in your Cup""", , , , , , 
42Lab,https://e27.co/42labs,http://www.42la.bs/,Hong Kong,"[[""Agency & Consulting"",""Mobile"",""Agency & Agency & Consulting"",""Information & Communications Technology""]]","42Labs is a software consultancy, R&D and coding mentoring company", , , , , , 
Treasure Hunter,https://e27.co/treasure-hunter,http://www.treasurehunter.co.kr/,South Korea,"[[""Advertising"",""E-commerce"",""Media""]]",Treasure Hunter as a “Next Media” business is pioneering the Asian mobile video content market. Treasure Hunter provides its users with a service that delivers fun content anywhere and anytime., , , , , , 
Nexus Mediaworks Consulting Sdn Bhd,https://e27.co/nexus-mediaworks-consulting-sdn-bhd,https://www.nexusmediacorp.com,Malaysia,"[[""Agency & Consulting""]]",An SEO company focusing very much on developing next generation of SEO PaaS System Automation using AI, , , , , , 
Jobtify,https://e27.co/jobtify,http://www.facebook.com/jobtify.co,Singapore,,Jobtify is a platform that notifies job seekers on quality freelance/part-time jobs opportunities in Singapore., , , , , , 
PT Global Tiket Network,https://e27.co/pt-global-tiket-network,http://www.tiket.com/,Indonesia,"[[""E-commerce"",""Transportation"",""Travel""]]",Tiket.com is the fastest growing online travel booking in Indonesia. Tiket.com focused heavily on domestic flights and hotels reservation in Indonesia., , , , , , 
SOINN Inc.,https://e27.co/soinn-inc,http://soinn.com/index.html,Japan,"[[""Big Data"",""Software as a Service""]]","SOINN Co., Ltd., offers a wide range of solutions that take advantage of the artificial brain SOINN technology.", , , , , , 
Future Stage Creations,https://e27.co/future-stage-creations-pte-ltd,http://www.futurestage.com.sg,Singapore,"[[""Advertising"",""Agency & Consulting"",""Design "",""Agency & Agency & Consulting"",""Entertainment""]]","FUTURE STAGE CREATIONS is active in Planning, rental and operation of audio systems for rock and pop concert and other events. ", , , , , , 
Altigreen Propulsion Labs,https://e27.co/altigreen-propulsion-labs,http://altigreen.in/,India,"[[""Energy""]]",Altigreen has created proprietary technology to facilitate the migration of road transport from standard fuels towards greener electric alternatives., , , , , , 
VENTURE UP,https://e27.co/venture-up,https://ventureup.com/,United States of America,"[[""Agency & Consulting""]]","Started its journey in 1983, Venture UP provides the fun-oriented group activities and events for corporate offices aimed at enhancing team spirits, improving relationships and employee engagement.", , , , , , 
AttainU,https://e27.co/attainu,https://www.attainu.com/,India,"[[""Education""]]",On a mission to build a scalable high-quality college alternative in India., , , , , , 
Chiiwii - Telemed,https://e27.co/chiiwii-telemed,http://www.chiiwii.com,Thailand,"[[""Healthtech""]]","Chiiwii mobile app providing accessible health consultation for women in the most efficient way. You can make appointment to connect with your preferred specialist via VDO call, voice call, chat.", , , , , , 
Instappy ,https://e27.co/instappy,http://www.instappy.com/,India,"[[""Mobile"",""Software as a Service"",""Agency & Consulting"",""Information & Communications Technology""]]",Instappy.com is a leading cloud-based app creation platform fast gaining popularity with users worldwide., , , , , , 
Peggo ,https://e27.co/peggo,https://www.peggopro.com/,United States of America,,Youtube and Soundcloud are two well-known video hosting sites in the world. Sometimes we utilize these multi-media portals only to listen to beautiful soundtracks than watching a particular video., , , , , , 
Bali Muslim Wedding & Honeymoon ,https://e27.co/bali-muslim-wedding-honeymoon,http://balimuslimwedding.com,Indonesia,"[[""Travel""]]",BaliMuslimWedding.com is unique online travel platform focusing on wedding  and honeymoon package promoting  local wedding venues and honeymoon accommodation  as well as  local activities across Bali, , , , , , 
info casting,https://e27.co/info-casting,http://casting.id,Indonesia,"[[""Advertising"",""Entertainment"",""Media"",""PR & Communications""]]",CASTING.ID is a media of casting and media information for media and film production house. Opening opportunities for newcomers to model & talent in the entertainment world., , , , , , 
Toppers Notes,https://e27.co/toppers-notes,http://www.toppersnotes.com/,India,"[[""Education""]]",ToppersNotes is an advanced educational portal started by IITians to bridge this preparation gap between a topper & average student, , , , , , 
CHEMISTRY India ,https://e27.co/chemistry-india,http://www.chemistryindia.com/,India,"[[""E-commerce"",""Retail""]]","CHEMISTRY is a fast growing women's fashion brand, specializing in both woven and knit segments.", , , , , , 
Between,https://e27.co/between-app-vcnc,http://between.us,Thailand,"[[""Mobile"",""Social Enterprise""]]","Between is currently the leading mobile couple application, with over 15 millions downloads. Their main markets are in South Korea, Tokyo, Japan, Taiwan, Singapore and Thailand.", , , , , , 
Tips,https://e27.co/tips,http://tips.com,United States of America,,Tips to get online help., , , , , , 
HelloGold,https://e27.co/hellogold,http://www.hellogold.com,Malaysia,"[[""Consumer"",""Finance"",""Mobile""]]","HelloGold is a financial services blockchain platform for mass market consumers in emerging markets to save, borrow and send real assets, starting with gold.", , , , , , 
Onytree Sdn Bhd,https://e27.co/onytree-sdn-bhd,http://www.upocket.com.my,Malaysia,"[[""Big Data"",""E-commerce"",""Food & Beverage"",""Mobile"",""Software as a Service""]]","Upocket app is One membership platform, to group all restaurants discount card in one. That enables user to conveniently COLLECT, SUBSCRIBE and STORE membership data.

thus the slogan: Easy for You", , , , , , 
AppSocially,https://e27.co/appsocially,http://appsocial.ly/,Japan,"[[""Big Data"",""Mobile"",""Software as a Service""]]",AppSocially (http://appsocial.ly) is an easy-to-use tool for mobile app developers to integrate customer-acquisition functions into their apps., , , , , , 
OneDee,https://e27.co/onedee-io,https://www.onedee.io,Thailand,"[[""Enterprise Solution"",""Software as a Service"",""Agency & Consulting""]]",We are cloud based HR Online platform and time attendance on the mobile application for small business that can help your business easier. Saving time and money. Just take time to grow your business, , , , , , 
NextID,https://e27.co/nextid,https://nextid.com,Singapore,,"NextID's offers a certificate issuance service that helps you produce next generation academic & professional certificates, that are cryptographically secure and verifiable.", , , , , , 
Muuve,https://e27.co/muuve,https://muuve.biz/,Cambodia,"[[""Food & Beverage""]]",Delivering Your Favorite Meal. Your favorite food can't wait to be eaten., , , , , , 
BuyBitcoin.ph,https://e27.co/buybitcoin-ph,https://buybitcoin.ph/,Philippines,"[[""Blockchain"",""Finance""]]",BuyBitcoin.ph works to spread the use of Bitcoin in the Philippines. This is done by running a service that makes it easier and faster to buy and sell bitcoins. , , , , , , 
Blockchain Foundry,https://e27.co/blockchain-foundry,http://www.blockchainfoundry.com/,Singapore,,Blockchain Foundry is an enterprise Blockchain Platform-as-a-Service and App Marketplace.The goal is to offer a lab like environment to help organizations test-drive blockchain applications., , , , , , 
MyCourseBook,https://e27.co/mycoursebook,https://www.mycoursebook.in,India,"[[""E-commerce""]]","Mycoursebook provides the books online at best price with fastest Delivery, with customer support available all weekdays. We have been delivering results since decades in this business.", , , , , , 
Muuyu,https://e27.co/muuyu,https://muuyu.com/,Singapore,"[[""Healthtech""]]","Muuyu is an online yoga platform which enables you to do live, interactive classes with teachers from all over the world at any time and in any space.", , , , , , 
CW2GREEN Co.Ltd.,https://e27.co/cw2green-co-ltd,http://www.cw2green.com,Thailand,"[[""Agritech"",""Energy"",""Internet of Things"",""Manufacturing""]]",to green technologogy, , , , , , 
ShopSmart.xyz,https://e27.co/shopsmart,http://shopsmart.xyz,Thailand,"[[""Consumer"",""E-commerce"",""Information & Communications Technology""]]",ShopSmart is a price comparison and community coupon site providing discounts and coupon codes for Southeast Asia, , , , , , 
Silamedia,https://e27.co/silamedia,http://silamedia.id,Indonesia,,SilaMedia is a company engaged in the field of Digital Consultants and Training. The special part of us is about Service and Training Service., , , , , , 
Audenki,https://e27.co/audenki,http://audenki.co,Singapore,"[[""Big Data"",""Advertising"",""Media"",""Mobile"",""Information & Communications Technology""]]","Audenki is an integrated ticketing gateway, real time social media streaming, management and analytic platform for event marketers, advertising agencies, corporate companies, hotels and FMCG industry.", , , , , , 
Iconoffices,https://e27.co/iconoffices,http://iconoffices.co.uk/virtual-offices.php,United Kingdom,,Icon Offices provides luxury serviced offices in the heart of East London / Essex., , , , , , 
Li Tong Group,https://e27.co/li-tong-group,http://www.litong.com/,Hong Kong,"[[""Hardware"",""Agency & Consulting""]]","Li Tong Group (LTG) is a valuable partner and service provider to its clients in the Technology, Electronics and Telecom (TET) sector.", , , , , , 
Percipient,https://e27.co/percipient,http://www.percipientcx.com/,Singapore,"[[""Big Data""]]","Percipient enables organisations to put data at the heart of all their decisions and drive scalable, efficient and cost ­effective growth by taking advantage of big data technologies.", , , , , , 
Nubefy,https://e27.co/nubefy,http://www.nubefy.com/,Singapore,"[[""Software as a Service"",""Agency & Consulting"",""Information & Communications Technology""]]",Nubefy is a cloud services management company that focuses on freeing customers from the dependency of single providers to cloud computing. , , , , , , 
South India Highlights,https://e27.co/south-india-highlights,http://www.southindiahighlights.com/,India,,"South India Highlights is a sister concern of Travelogy India Pvt. Ltd., that provides impeccable services for inbound travel in South Indian region.", , , , , , 
Besant techno,https://e27.co/besant-techno,https://www.besanttechnologies.com/,India,,, , , , , , 
LadoOsHadoO ,https://e27.co/ladooshadoo,http://ladooshadoo.com/,India,"[[""Consumer"",""E-commerce"",""Food & Beverage"",""Logistics\/Supply Chain"",""Manufacturing"",""Information & Communications Technology""]]",Laddoshaddo.com is new online store for fulfill your all desserts and chocolates needs at your doorstep, , , , , , 
Werthstein,https://e27.co/werthstein,https://www.werthstein.com/,Germany,,The informed way to invest - Wealth Management for the digital age. Werthstein means professional digital wealth management., , , , , , 
Futr,https://e27.co/futr,https://www.getfutrapp.com/,Australia,"[[""Software as a Service""]]",Send messages. Keep in touch with family and friends. Send messages immediately or queue them up with their scheduler., , , , , , 
PT.ConocoPhillips,https://e27.co/pt-conocophillips,http://carirconocophillips.blogspot.co.id,Indonesia,"[[""Energy""]]","Lowongan Kerja Terbaru PT ConocoPhillips Indonesia Inc. Ltd

Bagi Anda yang tertarik dengan lowongan kerja PT ConocoPhillips Indonesia Inc. 
Ltd lulusan SMA, SMK,DII,DIII, S1, S2, S3 terbaru untuk penempatan di seluruh 
Indonesia.", , , , , , 
The Golden Concepts,https://e27.co/the-golden-concepts,https://www.thegoldenconcepts.com/,Singapore,"[[""E-commerce""]]",The Golden Concepts is an e-commerce store that curates eldercare products to enable ageing well., , , , , , 
Legal IP Media,https://e27.co/legal-ip-media,http://www.lipmedia.co/,Singapore,"[[""Media""]]",Legal IP Media (LIPMedia.co) is a digital publication revolving around Intellectual Property focused in South East Asia., , , , , , 
Carpello,https://e27.co/carpello,https://www.facebook.com/carpellobiz/,Malaysia,,Carpello is a Fashion Brand which provides manufacturing service for clothing (minimum 10 pieces) & selling in-house limited edition apparel products., , , , , , 
Amicus Shopping Assistant,https://e27.co/amicus-shopping-assistant,http://amicshop.com/,India,"[[""Consumer"",""Big Data"",""Agency & Consulting"",""Software as a Service"",""Information & Communications Technology""]]","Amicus Technologies™ is a data analytics startup, founded to solve the problem of consumer complaints in the market of High Value Purchases.", , , , , , 
Bytes.pk,https://e27.co/bytes-pk,http://www.bytes.pk/,Pakistan,"[[""Consumer"",""E-commerce"",""Hardware""]]",bytes.pk is Pakistan's largest online store dedicated to electronics. Providing maximum value to customers by providing used and refurbished electronics., , , , , , 
Ship Automation,https://e27.co/ship-automation,http://shipautomation.com/,India,,"Ship Automation is a company that Sources , Repair and Supply Marine Automation & Electrical spares at attractive prices. Our experienced team of Engineers is available for support on all west coast.", , , , , , 
Encore Products ,https://e27.co/encore-products,http://www.encoreproducts.com,United States of America,,"EnCore Products, Inc., a division of Elmer’s Products, Inc., began manufacturing foam board in 1984 under the name Hunt Corporation.", , , , , , 
TenX,https://e27.co/tenx,http://www.tenx.tech/,Singapore,"[[""Blockchain""]]",At TenX they make cryptocurrencies spendable in real life! They are the only company worldwide that offers multiple cryptocurrencies to be spent through a debit card to use anytime anywhere., , , , , , 
Tripity,https://e27.co/tripity,http://tripity.eu/,Estonia,,Private tours and entertainment - the best way to explore the world through the services of Tripity. , , , , , , 
Aspiring Minds,https://e27.co/aspiring-minds,http://www.aspiringminds.com/,India,"[[""Agency & Consulting"",""Big Data"",""Education"",""Human Resources"",""Agency & Agency & Consulting"",""Information & Communications Technology""]]","Aspiring Minds, a job-credentialing leader, delivers the world’s most widely-used employability test and the only standardized test designed for job matching. ", , , , , , 
Footfalls & Heartbeats,https://e27.co/footfalls-heartbeats,http://footfallsandheartbeats.com/,New Zealand,"[[""Enterprise Solution""]]",Footfalls & Heartbeats is a New Zealand-based company founded by award winning chemist Simon McMaster., , , , , , 
AHA Taxis,https://e27.co/aha-taxis,http://www.ahataxis.com/,India,"[[""Enterprise Solution"",""Transportation"",""Travel"",""Information & Communications Technology""]]",AHA Taxis is online booking service offering one way fares for outstation travel across India, , , , , , 
Cleartitle Properties,https://e27.co/cleartitle-properties,https://www.cleartitlerealty.com,India,,We are a team of specialists working together to satisfy every requirement of our vast clients., , , , , , 
Pioneer,https://e27.co/pioneer,https://e27.co/startups,, ,Pioneer today is two people: Daniel Gross and Rishi Narang. We're also supported by an amazing team of part-time contributors and experts., , , , , , 
RoadGods,https://e27.co/roadgods,http://www.roadgods.com/,India,"[[""E-commerce"",""Sports"",""Transportation""]]",RoadGods is the kingdom of Earth Explorers. The realm of the Rulers of tarmac and the Kings of Off-Roading., , , , , , 
LinguaNext Technologies,https://e27.co/linguanext-technologies,http://www.linguanext.net/,India,"[[""Enterprise Solution"",""Software as a Service""]]",LinguaNext Technologies is the market leader in language management platform for software applications and has transformed the way global corporations address multi-language support., , , , , , 
Vision40IITAcademy,https://e27.co/vision40iitacademy,http://www.vision40.co.in/,India,,"Best IIT Coaching in Hyderabad managed by young, dynamic and highly experienced faculty team We at Vision40, dedicated in coaching various competitive exams and offer Integrated JEE, BITSAT", , , , , , 
SafeChats,https://e27.co/safechats,http://safechats.com/,Singapore,"[[""Software as a Service"",""Information & Communications Technology""]]",SafeChats is a secure and efficient communications platform for everyone, , , , , , 
Gravicode,https://e27.co/gravicode,http://gravicode.com,Indonesia,,Cutting edge tech for enterprise, , , , , , 
Travelo.Ninja,https://e27.co/travelo-ninja,http://travelo.ninja/,India,,TravelO.Ninja  is apt travel site for you and your favourite adventure is just a click away. Grab your dream of travelling world with us., , , , , , 
Unpossible,https://e27.co/unpossible,http://www.unpossibleapp.com/,Hong Kong,"[[""Gaming""]]",Unpossible is Hong Kong startup focused on creating mobile games which make people smiles., , , , , , 
Mobile App Experts,https://e27.co/mobile-app-experts,http://www.mobileappexperts.org/,India,"[[""Mobile"",""Software as a Service"",""Agency & Consulting"",""Information & Communications Technology""]]",They are premier Mobile App development company offering wide range of solutions & services for Mobile Phones and Web based products. , , , , , , 
Reva University Bangalore,https://e27.co/reva-university-bangalore,http://www.admissioninfo.co.in/reva-university-institutes-bangalore.html,India,,"REVA University Institutes Bangalore one of finest universities provides admission through NRI Quota, Management Quota, Direct Admission, fee structure for MBA, M Tech, B E, B Tech, BBA, B Com, MCA an", , , , , , 
Bereev,https://e27.co/bereev,https://bereev.com,Malaysia,"[[""Finance"",""Insurtech"",""Software as a Service""]]","Bereev is a legacy planning app that helps you prepare for the inevitable, death.

Create a #DeathPlan on Bereev which will guide your loved ones if anything happens to you.", , , , , , 
Emitsys,https://e27.co/emitsys,http://www.Emitsys.com,Thailand,"[[""Big Data"",""E-commerce"",""Education"",""Information & Communications Technology""]]","We love to analyze content and decompose them to many pieces. Then, we classify them and re-construct the content in a better design (website re-generation, catalog presentation, document organization", , , , , , 
Lockin Company,https://e27.co/lockin-company,http://lockincomp.com/,South Korea,"[[""Cybersecurity""]]",Lockin Company has developed a security solution that protects against the leaking of source code through complex encryption., , , , , , 
Cricket Betting Tips | CBTF,https://e27.co/cricket-betting-tips-cbtf,http://samratcricketbettingtips.com/,India,,"Get Online Cricket Betting Tips, Free Cricket Betting Tips, Free Cricket Betting Tips, CBTF, IPL Betting Tips, Big Bash Betting Tips, Ram Slam Betting Tips, etc. Visit at samratcricketbettingtips.com", , , , , , 
Beam Storage Pte Ltd,https://e27.co/beam-space,https://www.beamspace.com/,Singapore,"[[""Consumer"",""Enterprise Solution""]]","BEAM is a concierge storage app providing warehousing and logistics services. No more wasted hours in warehouses, you can plan deliveries and view all stored items on the phone from the office or home", , , , , , 
ARENA LAPTOP,https://e27.co/arena-laptop,https://www.arenalaptop.com/,Indonesia,"[[""E-commerce"",""Social Enterprise""]]","Providing information about the latest laptop price, new product reviews, technology news, tips and tricks.", , , , , , 
mobiletao.org,https://e27.co/mobiletao-org,http://www.mobiletao.org/,Philippines,"[[""Mobile"",""Software as a Service"",""Information & Communications Technology""]]","mobileTAO is a mobile R&D group that empowers mobile IT professionals, serves the community, and helps build the nation thru mobile technologies.", , , , , , 
PT Printera Global Cetak,https://e27.co/printera-1,http://printera.com,Indonesia,"[[""E-commerce""]]","Printera is a printing service cater to business at any size. Whether you're a one man company or large corporation, you will love our convenience, competitive pricing, and delivery speed.", , , , , , 
Funtu Infoedge Technologies Private Limited,https://e27.co/funtu-infoedge-technologies-private-limited,http://www.travelfuntu.com,India,"[[""Travel""]]","We created Travelfuntu.com, an online travel marketplace, to connect you with travel agents who specialize in the exact vacation experience that you are looking for.", , , , , , 
RidinwithRob,https://e27.co/ridinwithrob,https://www.ridinwithrob.vegas,United States of America,,"Ridin With Rob’s car service can provide a Luxury car, a roomy SUV or whatever your heart desires, with – of course – our personal driver.", , , , , , 
Safexbikes,https://e27.co/safexbikes,http://www.safexbikes.com/,India,"[[""Automotive"",""E-commerce""]]",Safexbikes Motorcycle Superstore is the only Indian online store selling Motorcycle Parts and Accessories of almost all the models of Indian bike manufact., , , , , , 
Supernewsroom,https://e27.co/supernewsroom,http://www.supernewsroom.mobi/,Malaysia,"[[""Big Data"",""Advertising"",""Media""]]","Supernewsroom is a digital media relations platform, which contains media database in a single hub.", , , , , , 
Trebene,https://e27.co/trebene,http://www.trebene.com/,Singapore,"[[""Consumer"",""E-commerce"",""Retail""]]",Trebene is a luxury label of handcrafted scarves for the discerning woman., , , , , , 
MelissaWithLove.co,https://e27.co/melissawithlove-co,http://www.melissawithlove.co,United States of America,,Luxury beauty and personal care products handcrafted with all-natural ingredients sustainably-sourced from the USA and scented with premium essential oils., , , , , , 
Newton Circus Pte Ltd,https://e27.co/newton-circus-pte-ltd,http://newtoncircus.co/,Singapore,,Newton Circus is a social enterprise and technology company inventing communities and services that make the world a better place., , , , , , 
The Ashleys,https://e27.co/the-ashleys,http://theashleys.co.in/,India,,Our Company provides you best in class interior design services in mumbai , , , , , , 
Sunteck Realty Limited,https://e27.co/sunteck-realty-limited,http://www.sunteckindia.com/,India,"[[""Real Estate""]]","Sunteck Realty, premium property builders and developers in Mumbai offer luxurious 2 bhk, 3 bhk, 4 bhk and 5 bhk projects for the ultra- elite residential segment.", , , , , , 
Okan Inc.,https://e27.co/okan-inc,http://office.okan.jp/,Japan,"[[""Consumer"",""Food & Beverage""]]",okan Inc. provides food delivery service for corporations and individual customers., , , , , , 
A SPACE ,https://e27.co/aspace,http://aspacemanila.com,Philippines,"[[""Real Estate"",""Platform"",""Agency & Consulting"",""Information & Communications Technology""]]","A SPACE is first mover + largest community for aspirational start-ups, growing teams, new companies arriving in the Philippines. LIVE WORK GATHER GROW.", , , , , , 
